{
  "prompt": "Use case: stylized-concept. Make ONE exquisite integrated Fool pathway + rank 3 insignia, continuing a coherent family of ornate mask-and-curtain numerals. Reference 1 supplies the Fool theatrical half-mask and smoky-purple curtain identity; reference 2 supplies the exact readable Arabic numeral 3. Agentic sculptural redesign: fuse their structure and negative spaces into ONE complete object, never a numeral pasted over a separate crest. Two generous curtain arcs form the upper and lower bowls of 3, BOTH OPEN TO THE LEFT; carve the mask profile along the outer right spine. Preserve the central waist and avoid an 8 silhouette. The ONLY readable digit is 3, unmistakable small. Antique pale gold, mist silver, ivory carved mask, smoky violet enamel drapery; museum jewelry-level microchasing, sculptural relief, satin recesses and polished bevels. Rich but coherent detail, no surrounding badge, no words, no other digit. FRONT ORTHOGRAPHIC square image; full object centered with generous 8% clear margins, no cropped tips. Genuinely transparent background including internal openings; no white backdrop or checkerboard pixels, no external cast shadow. Preserve the mask's identity and the numeral's readability together.",
  "tool": "image_gen.imagegen",
  "model": null,
  "seed": null,
  "created_at": "2026-09-13",
  "attempt": 1,
  "attachments": [
    {
      "path": "artifacts/production/sigil-fool/v001/raw.png",
      "sha256": "8bed2bf6163130e465f09b8896f2e709bc50e6c3436712de358ed4c68a8a3b1d",
      "role": "style"
    },
    {
      "path": "artifacts/production/fool-numeral-3/v001/raw.png",
      "sha256": "e1ea4a20d8480409d7a13e4037b1604c909e700b4d9e613cd0c34af8ee2c6918",
      "role": "geometry"
    }
  ],
  "observation": "已实际观察：上下两弧向左开放，面具融入右侧连接脊，3轮廓明确。 与既有紫金/象牙面具系列一致，非机械叠加。背景呈棋盘格，需实际解码判定；保留艺术原稿，新稿待用户确认，不把净底状态等同于艺术评价。"
}
