{
  "prompt": "Use case: stylized-concept. Asset type: ONE standalone collectible occult pathway emblem, precision jewelry-grade relief artwork for a card asset library. Original artistic interpretation for the 门 / door pathway, NOT a copied official religious emblem. Primary design: Three nested silver-blue portal jambs fold through impossible right-angle transitions around a deep cobalt crystal void, forming a tall architectural keyhole-like crest. Peacock-blue enamel, star-silver filigree, transparent mineral inlays. Crisp rectangular silhouette; no gears, no mask, no text. Craftsmanship: museum-quality micro-chased metal, layered pierced openwork, satin recesses contrasting polished bevels, restrained precious inlays; rich sculptural depth and genuinely exquisite detail, NOT a flat vector outline or generic app icon. One coherent primary symbol with a bold readable silhouette, not a pile of objects. Straight-on orthographic view, whole emblem centered occupying about 78% of a SQUARE canvas, generous clean margin. Soft upper-left studio illumination; no ground plane or cast shadow outside the object. GENUINELY TRANSPARENT background, including all internal openwork holes; no black rectangle, no white rectangle, no checkerboard pixels. No text, letters, digits, watermark, card border, human portrait or surrounding scene.",
  "tool": "image_gen.imagegen",
  "model": null,
  "seed": null,
  "created_at": "2026-09-13",
  "attempt": 1,
  "attachments": [],
  "observation": "已实际观察：三重折转蓝银门扉和中央蓝色矿物空间，主形纵长、雕刻细节明显；中央蓝色是徽章实体设计，不要求那部分透明。需试装核验外缘。"
}
