{
  "prompt": "Use case: stylized-concept. Asset type: reusable pathway background material, not a card or illustration. Primary request: midnight blue-black silk-like archive paper with ghostly vertical curtain-fold fibers and extraordinarily subtle silver-gray thread, mysterious but quiet. Flat orthographic full-bleed texture, neutral diffuse light, even exposure, low contrast, no central spotlight. No character, no face, no eyeball, no tentacle, no symbol, no digit, no text, no frame. Portrait 2:3. Reusable veil material, original artistic proposal, not an official emblem.",
  "tool": "image_gen.imagegen",
  "model": null,
  "seed": null,
  "created_at": "2026-09-13",
  "attempt": 1,
  "attachments": [],
  "observation": "真实暗蓝帷幕纤维纹理，无字无标；纵向结构清楚，适合作途径底材，尚未验证平铺，不声明平铺。"
}
