{
  "prompt": "Use case: stylized-concept. Asset type: ONE exquisite standalone artistic Arabic numeral \"8\", for the Fool pathway's collectible card rank asset. The ONLY readable character must be 8. A bold elegant custom numeral sculpture built from antique pale-gold metal and mist-silver bevels, with smoky-violet enamel inset and extremely fine engraved curtain-fold channels within its broad stroke. Unbroken unmistakable 8 silhouette, generous open counters where the numeral has them. Thick enough to remain readable small, lavish jewelry-grade chasing and openwork along the edges, NOT ordinary printed type, not a plain thin line. No surrounding crest, no mask, no additional numeral, no label, no words. Straight-on flat frontal presentation, centered on SQUARE canvas, occupies 75%, full object visible with margin. Soft upper-left light, real relief and dark satin recesses. GENUINELY TRANSPARENT background including holes. No ground plane, no painted shadow rectangle, no checkerboard pixels.",
  "tool": "image_gen.imagegen",
  "model": null,
  "seed": null,
  "created_at": "2026-09-13",
  "attempt": 1,
  "attachments": [],
  "observation": "已实际观察：数字8轮廓清楚，紫色宽笔画、金银细雕与已生成同组一致。数字3和5尖端占幅偏满，不能额外裁切；透明度由总览验证，未批准。"
}
