{
  "prompt": "基于所附的《诡秘之主》愚者途径低序列卡框，生成一张中序列愚者途径卡框迁移测试稿。这是严格的 image-to-image 结构保真测试，不是重新设计。低序列参考图是唯一结构来源，必须尽量逐像素保留 2048×3072 画布比例、透明背景、完整外轮廓、左右初版卷曲帷幕侧柱的形状/宽度/上下端收口/左右对称关系、顶部圣徽预留区域、中央插画窗口、底部姓名承接区、底部钻石的中心/大小/外框/切面、所有负空间和锚点；不得平移、缩放、旋转、透视变形、增删结构。只把品质材质迁移为中序列：主色采用翡翠绿 #55B978，绿色只进入边框纹理、珐琅和宝石反光，保留银白金属骨架与愚者紫色凹槽；通过更饱满的翡翠光泽、精确宝石折射和细腻金属层次表达中序列，不增加繁复度。不要加入翅膀、王冠、额外边框、额外圣徽、文字、数字、伪文字或新装饰。输出只能是干净的空卡框：无人物、无场景、无黑底、无白底、无棋盘格，保留真实 alpha；正视、完整、不裁切、不倾斜、不多卡拼图。结构优先于自由发挥。",
  "tool": "image_gen",
  "model": null,
  "seed": null,
  "created_at": "2026-09-14",
  "attempt": 1,
  "attachments": [
    {"path": "artifacts/production/fool-five-tier-direct-kit-v1/frame-low-native.png", "sha256": "14c8707f23c6e295c4b0c7ec25ee5cd7b11f028d7ccda09656baccf3166e8783", "role": "edit_target"}
  ],
  "observation": "实测迁移结果保住了愚者双侧帷幕的粗粒度轮廓和翡翠中序列色相，但不满足生产母版门禁：生成文件为 1024×1536 RGB、无 alpha，棋盘格已烘焙；参考母版为 2048×3072 RGBA。将低序列 alpha 统一到 1024×1536、以生成稿 chroma>12 作为前景近似的启发式比较，轮廓 IoU=0.767128；稳定柱体边界误差 p95=2 normalized px（约 4 final px），端部/底部最大误差 247 normalized px。程序版 frame-low→frame-mid 的 alpha IoU=1.0、bbox 完全一致。结论：Agentic 本次具备粗轮廓与材质创造力，但发生分辨率、alpha、底色和局部几何漂移；保留为 candidate-study/reference-only，不得直接作为 FrameCore、生产母框或正式交付。"
}
