{
  "prompt": "Use case: compositing. Produce ONE exquisite full-bleed 2:3 portrait oil painting to fit the complete identity card frame in image 1. Image 1 is the actual fixed layout and material reference (frame + mask-shaped numeral 9 + Chinese name + title); image 2 is the exact character/scene identity to preserve and recompose. Output ONLY the integrated character AND full environment painting, NOT the frame or its text/emblem: those exact original pixels will be overlaid afterward. This is not an inset picture: the room and atmosphere continue continuously to every canvas edge, behind the future frame. Match image 1's antique pale silver, restrained gold, smoky plum violet and silk palette with natural room materials and lighting. Plan the FINAL OVERLAY in image 1: top central x38-62%, y8-25% must be quiet very dark smoky-purple room atmosphere without objects or highlights, to keep the emblem/title legible. Character hair top at y29%, face centered around x46%, y42%, hands and pendulum around y60-69%, tea cup around x65%, y73%, tabletop small materials around y79%; all critical narrative objects inside x18-82%, y29-82%. Nameplate overlays y84-92%, so no crucial objects there. Preserve Klein's exact youthful scholarly face from image 2, black hair, brown eyes, Victorian dark coat and white collar, contemplative cautious expression. Anatomical LEFT hand on viewer right holds fine silver chain and ONE yellow citrine suspended over a porcelain red-tea cup. Other hand rests beside an open book of blank pale pages with faint abstract ink-wash only. Keep a small open dark wooden case with an opaque black vial and softly jelly-like star-speckled crystal, and a small empty dark medicine cup separate from the ornate tea cup. Tiny subordinate motifs, not a literal potion ritual or instructional diagram. Background seamlessly integrated: dim Victorian study, understated bookshelves at left, quiet smoky-purple drapery, hazy blue-violet Tingen window at right, low amber lamp; coherent painterly realism and reflected light, mysterious human-scale divination. Darkened upper space is still real room atmosphere not a flat graphic block, with a gentle organic transition into the portrait. Outer edges dark and subtly plum, not blank or blurred bands. One cohesive full environment, no pasted photo rectangle, inset boundary, panel, card border, ornamental rail, badge, mask, numeral, Chinese text, labels, writing, watermarks, magic beams, tentacles, puppetry, throne, extra people. Deliver opaque 2:3 full artwork, original identity frame supplied as reference only.",
  "tool": "image_gen",
  "model": null,
  "seed": null,
  "created_at": "2026-09-13T11:55:09Z",
  "attempt": 1,
  "attachments": [
    {
      "path": "artifacts/production/klein-identity-v3/reference.png",
      "sha256": "d5179d39b18af70270e2db6fde3d75c40fbb687ba23b0325f7430d8b7e2679dc",
      "role": "geometry"
    },
    {
      "path": "artifacts/production/klein-seer-subject/v002/raw.png",
      "sha256": "16fa28928a7bbdc93403d53c3d59122973b195e964bc775c1542dbddac2d9f4e",
      "role": "edit_target"
    }
  ],
  "observation": "已观察实际1024×1536原图：人物与室内背景连续一体；银链黄水晶悬在茶杯上方；黑瓶、星点晶体及空杯仍在桌前。未见生成边框、圣徽或正文文字。顶部留白和下部材料可能与身份框重叠，须以实际合成检查；未批准。"
}
