{
  "prompt": "Use case: stylized-concept. Asset type: ONE standalone collectible occult pathway emblem, precision jewelry-grade relief artwork for a card asset library. Original artistic interpretation for the 太阳 / sun pathway, NOT a copied official religious emblem. Primary design: A magnificent radiant solar rosette with twelve broad sculpted flame-like rays alternating with thin chiseled sunbeams; a warm white enamel core and tiny vermilion glass accents. Rich sunlight gold and ivory, precious engraved edges. Distinct radial sun silhouette, no face, no crown. Craftsmanship: museum-quality micro-chased metal, layered pierced openwork, satin recesses contrasting polished bevels, restrained precious inlays; rich sculptural depth and genuinely exquisite detail, NOT a flat vector outline or generic app icon. One coherent primary symbol with a bold readable silhouette, not a pile of objects. Straight-on orthographic view, whole emblem centered occupying about 78% of a SQUARE canvas, generous clean margin. Soft upper-left studio illumination; no ground plane or cast shadow outside the object. GENUINELY TRANSPARENT background, including all internal openwork holes; no black rectangle, no white rectangle, no checkerboard pixels. No text, letters, digits, watermark, card border, human portrait or surrounding scene.",
  "tool": "image_gen.imagegen",
  "model": null,
  "seed": null,
  "created_at": "2026-09-13",
  "attempt": 1,
  "attachments": [],
  "observation": "已实际观察：金白放射日轮与红色小嵌饰，区别于蓝银门与紫色面具。火焰尖端接近画布边缘；观察不能确认所有射线数量符合提示词，数量不是正典断言。"
}
